{
  "ruleset": "dnd-5e-2024",
  "type": "spell",
  "id": "frost-lance",
  "name": "Frost Lance",
  "summary": "A spear of ice that pierces a target and slows its movement.",
  "stats": {
    "level": 1,
    "school": "evocation",
    "classes": ["sorcerer", "wizard"],
    "castingTime": { "amount": 1, "unit": "action" },
    "ritual": false,
    "range": { "kind": "distance", "feet": 60 },
    "components": { "v": true, "s": true, "m": { "text": "a sliver of ice" } },
    "duration": { "kind": "instantaneous", "concentration": false },
    "effect": "Make a ranged spell attack against a creature within range. On a hit, the target takes 3d8 Cold damage, and its Speed is reduced by 10 feet until the start of your next turn.",
    "higherLevels": "The damage increases by 1d8 for each spell slot level above 1."
  },
  "tags": { "theme": "ice" },
  "meta": { "createdAt": "2026-11-02", "source": { "kind": "routine", "issues": [2] } }
}
